{
  "schema_version": "v2-promotion-command-receipt/v1",
  "promotion_stage": "canary_to_public",
  "qualification_status": "PUBLIC_AUTHORIZED",
  "evaluation_id": "sha256:cccccccccccccccccccccccccccccccccccccccccccccccccccccccccccccccc",
  "gate_evaluation_id": "sha256:dddddddddddddddddddddddddddddddddddddddddddddddddddddddddddddddd",
  "authorized_response_types": ["ABSTAIN"],
  "blocked_response_types": ["BUY_NOW", "FACTUAL_OPTIONS", "WAIT"],
  "persistence_status": "created",
  "receipt_id": 12,
  "raw_payload_retained": false
}
